<?xml version="1.0" encoding="UTF-8"?>
<INFO xmlns:xsi="http://www.w3.org/2001/XMLSchema-instance"
 xsi:noNamespaceSchemaLocation="file:/D:/GitHub/Interface/431000/source/XML%26JSON/BDC_Response.xsd">
    <RESULT_FLAG>1</RESULT_FLAG>
    <RESULT_MESSAGE>查询成功!</RESULT_MESSAGE>
    <QLR>
        <FSQRMC>FSQRMC0</FSQRMC>
        <FZJHM>FZJHM0</FZJHM>
        <FDCQINFO>
            <FDCQ>
                <CQZH>CQZH0</CQZH>
                <FBDCDYH>FBDCDYH0</FBDCDYH>
                <FFDZL>FFDZL0</FFDZL>
            </FDCQ>
            <FDCQ>
                <CQZH>CQZH1</CQZH>
                <FBDCDYH>FBDCDYH1</FBDCDYH>
                <FFDZL>FFDZL1</FFDZL>
            </FDCQ>
        </FDCQINFO>
    </QLR>
    <QLR>
        <FSQRMC>FSQRMC1</FSQRMC>
        <FZJHM>FZJHM1</FZJHM>
        <FDCQINFO>
            <FDCQ>
                <CQZH>CQZH2</CQZH>
                <FBDCDYH>FBDCDYH2</FBDCDYH>
                <FFDZL>FFDZL2</FFDZL>
            </FDCQ>
            <FDCQ>
                <CQZH>CQZH3</CQZH>
                <FBDCDYH>FBDCDYH3</FBDCDYH>
                <FFDZL>FFDZL3</FFDZL>
            </FDCQ>
        </FDCQINFO>
    </QLR>
</INFO>
